id,URL,headline,author,date
0,https://www.theverge.com/2023/4/8/23674577/apple-airpods-pro-ring-video-doorbell-pro-2-apple-ipad-amazon-kindle-deal-sale,Apple’s latest AirPods Pro have hit their all-time low at Amazon,Sheena Vasani,2023-04-08T14:07:43
1,https://www.theverge.com/23662032/smartphone-dumb-phone-tik-tok-instagram-mental-health,"In celebration of the dumb phone, a rare sanity-saving gadget",Sheena Vasani,2023-04-08T13:00:00
2,https://www.theverge.com/2023/4/8/23675801/substack-ceo-pushes-back-at-elon-says-twitter-situation-is-very-frustrating,"Substack CEO pushes back at Elon, says Twitter situation is “very frustrating”",Nilay Patel,2023-04-09T00:08:13
3,https://www.theverge.com/23674395/dell-xps-13-2022-intel-review,Dell XPS 13 review: Dell is coasting (and that’s fine),Monica Chin,2023-04-08T12:30:00
4,https://www.theverge.com/23673132/hatch-restore-2-review-tiktok-sleep-tech,Hatch Restore 2 review: TikTok made me try it,Victoria Song,2023-04-09T12:00:00
